{
  "id": "084-header-case-insensitivity",
  "name": "Header case insensitivity",
  "description": "Headers use non-standard casing - parsers should handle case-insensitively",
  "spec_references": [
    "RFC 7578 Section 4.4"
  ],
  "category": "content-types",
  "tags": [
    "required",
    "parsing"
  ],
  "expected": {
    "valid": true,
    "parts": [
      {
        "name": "field",
        "filename": null,
        "content_type": null,
        "body_text": "value",
        "body_size": 5
      }
    ]
  },
  "notes": "HTTP headers are case-insensitive per RFC 7230"
}
