{
  "id": "040-simple-boundary",
  "name": "Simple alphanumeric boundary",
  "description": "Boundary using only alphanumeric characters",
  "spec_references": [
    "RFC 2046 Section 5.1.1"
  ],
  "category": "boundaries",
  "tags": [
    "required",
    "parsing"
  ],
  "expected": {
    "valid": true,
    "parts": [
      {
        "name": "field",
        "filename": null,
        "content_type": null,
        "body_text": "value",
        "body_size": 5
      }
    ]
  },
  "notes": "Simple boundary without special characters"
}
