{
  "id": "024-filename-with-spaces",
  "name": "Filename with spaces",
  "description": "Filename containing space characters",
  "spec_references": [
    "RFC 7578 Section 4.2"
  ],
  "category": "filenames",
  "tags": [
    "required",
    "parsing"
  ],
  "expected": {
    "valid": true,
    "parts": [
      {
        "name": "file",
        "filename": "my document.pdf",
        "content_type": "application/pdf",
        "body_text": "PDF content",
        "body_size": 11
      }
    ]
  },
  "notes": "Spaces in filenames are common and must be preserved"
}
