{
  "id": "102-binary-content",
  "name": "Binary content",
  "description": "File containing all possible byte values (0x00-0xFF)",
  "spec_references": [
    "RFC 7578 Section 4"
  ],
  "category": "edge-cases",
  "tags": [
    "required",
    "parsing"
  ],
  "expected": {
    "valid": true,
    "parts": [
      {
        "name": "binary",
        "filename": "all-bytes.bin",
        "content_type": "application/octet-stream",
        "body_base64": "AAECAwQFBgcICQoLDA0ODxAREhMUFRYXGBkaGxwdHh8gISIjJCUmJygpKissLS4vMDEyMzQ1Njc4OTo7PD0+P0BBQkNERUZHSElKS0xNTk9QUVJTVFVWV1hZWltcXV5fYGFiY2RlZmdoaWprbG1ub3BxcnN0dXZ3eHl6e3x9fn+AgYKDhIWGh4iJiouMjY6PkJGSk5SVlpeYmZqbnJ2en6ChoqOkpaanqKmqq6ytrq+wsbKztLW2t7i5uru8vb6/wMHCw8TFxsfIycrLzM3Oz9DR0tPU1dbX2Nna29zd3t/g4eLj5OXm5+jp6uvs7e7v8PHy8/T19vf4+fr7/P3+/w==",
        "body_size": 256
      }
    ]
  },
  "notes": "Tests that parser handles all byte values correctly"
}
